<?xml version="1.0" standalone="yes"?>
<locc xmlns:xsi="http://www.w3.org/2001/XMLSchema-instance" xsi:schemaLocation="https://www.cthing.com/schemas/locc-1.xsd locc-1.xsd" formatVersion="1" date="${xmlunit.ignore}" projectName="simple-project" projectVersion="unspecified" xmlns="http://www.cthing.com/locc">
    <languages numLanguages="3" totalLines="78" codeLines="40" commentLines="29" blankLines="9">
        <language name="Css" displayName="CSS" totalLines="7" codeLines="7" commentLines="0" blankLines="0"/>
        <language name="Html" displayName="HTML" totalLines="12" codeLines="12" commentLines="0" blankLines="0"/>
        <language name="Java" displayName="Java" totalLines="59" codeLines="21" commentLines="29" blankLines="9"/>
    </languages>
    <files numFiles="5" numUnrecognized="0" totalLines="78" codeLines="40" commentLines="29" blankLines="9">
        <file pathname="src/main/java/com/cthing/testproject/HelloWorld.java">
            <language name="Java" displayName="Java" totalLines="32" codeLines="11" commentLines="17" blankLines="4"/>
        </file>
        <file pathname="src/main/java/com/cthing/testproject/package-info.java">
            <language name="Java" displayName="Java" totalLines="10" codeLines="1" commentLines="8" blankLines="1"/>
        </file>
        <file pathname="src/main/resources/sample.css">
            <language name="Css" displayName="CSS" totalLines="7" codeLines="7" commentLines="0" blankLines="0"/>
        </file>
        <file pathname="src/main/resources/sample.html">
            <language name="Html" displayName="HTML" totalLines="12" codeLines="12" commentLines="0" blankLines="0"/>
        </file>
        <file pathname="src/test/java/com/cthing/testproject/HelloWorldTest.java">
            <language name="Java" displayName="Java" totalLines="17" codeLines="9" commentLines="4" blankLines="4"/>
        </file>
    </files>
</locc>
